{
	"$schema": "task_schema.json",
	"task_type": "DocumentClassification",
	"train_file_path": "/users/data/d3m/datasets/training_datasets/LL1/LL1_sentiment_self_drive/LL1_sentiment_self_drive_dataset/tables/learningData.csv",
	"document_list"	: [
		{
			"column_indices": [
				1
			]
		}
	],
	"target": {
		"column_index": 2
	}
}